title,organization,rating,review_count,difficulty,course_type,duration,skills,url,is_free,course_id
music production,Berklee,4.776318441383944,2977,Beginner,Specialization,THREE_TO_SIX_MONTHS,music musical_composition postproduction peer_review media_production active_listening music_performance constructive_feedback performing_arts editing instrumental_music music_theory timeline file_management selfawareness creativity,/specializations/music-production,False,s12n~zkV7-RZKEea3nArFC-QKGw
real_estate development building value community,University of Michigan,4.888888888888889,36,Beginner,Course,ONE_TO_THREE_MONTHS,financial_modeling community_development real_estate feasibility_studies financial analysis_risk_management return investment commercial real_estate community outreach project_finance due diligence property management project_risk_management project_design project_management capital_markets cash flow market_research,/learn/real-estate-development-building-value-in-your-community,False,course~TRsT0ty3Ee6J_wr_0biVVQ
talent_acquisition,HRCI,4.822800495662949,1614,Beginner,Course,ONE_TO_FOUR_WEEKS,talent_acquisition recruitment full cycle recruitment job_analysis recruitment_strategies employee onboarding negotiation employee_retention talent sourcing talent_management human_resources interviewing_skills forecasting labor_law,/learn/talent-acquisition,False,course~RtWCiPi1Ee2OqwqhrYNGhQ
introduction responsible ai,Google Cloud,4.67887323943662,710,Beginner,Course,ONE_TO_FOUR_WEEKS,data_ethics artificial_intelligence accountability business_ethics governance organizational_effectiveness ethical_standards conduct,/learn/introduction-to-responsible-ai,False,course~ZOaxMgNuEe6avhLjR2t3Lw
fundamental project_planning management,University of Virginia,4.749000487567041,10255,Beginner,Course,ONE_TO_FOUR_WEEKS,planning project_planning earned_value management_stakeholder_management risk management_project_management project scoping milestones_project_management project_schedules risk_analysis dependency_analysis agile_methodology kanban_principles,/learn/uva-darden-project-management,False,course~VcGV0kxGEeWKRQoYMLwAUw
evaluation ai application healthcare,Stanford University,4.548494983277592,299,Beginner,Course,ONE_TO_THREE_MONTHS,data_ethics artificial_intelligence health_technology healthcare_industry_knowledge health_care patient_safety health_equity health_disparities regulatory_compliance application_deployment continuous_monitoring clinical_data_management decision_support_systems predictive_modeling,/learn/evaluations-ai-applications-healthcare,False,course~OHlOT2raEeq6owp3Zy5rmQ
professional selling step highperformance,Kennesaw State University,4.725352112676056,71,Beginner,Specialization,THREE_TO_SIX_MONTHS,sale prospecting prospecting qualification sales_process overcoming_objections selling technique sale verbal_communication_skills cold calling sales_presentation sales_sales strategy_customer relationship_building general sale practice needs_assessment rapport_building sale pipeline solution selling communication consumer_behaviour lead_generation,/specializations/professionalselling,False,s12n~2Jg6e40YEe2rnw4-ASaXyw
everyday parenting abc child rearing,Yale University,4.906864324846922,3103,Beginner,Course,ONE_TO_FOUR_WEEKS,behavior_management positive_behavior support parent_communication mental_health deescalation technique family therapy child_development,/learn/everyday-parenting,True,course~pIODBrinEea7HhLAXRS5cg
healthcare management finance,University of Michigan,4.641304347826087,92,Beginner,Specialization,ONE_TO_THREE_MONTHS,health_care administration clinical_leadership community_health financial_statement mergers_acquisitions capital budgeting price_negotiation financial_accounting public_health financial_statement_analysis human_resources_management planning strategic decisionmaking financial_analysis health_systems electronic medical_record financial_management balance_sheet accounting strategic_planning marketing,/specializations/healthcare-management-and-finance,False,s12n~rVYT5_ycEeyNxw76_Wg-Yw
narrative economics,Yale University,4.792838874680307,782,Beginner,Course,ONE_TO_FOUR_WEEKS,behavioral_economics storytelling_data storytelling economics economic_development financial_forecasting forecasting socioeconomics social_studies consumer_behaviour analysis complex_problem solving,/learn/narrative-economics,True,course~PI-xSbH_Ee2d3wo_DItpEw
terrorism counterterrorism comparing theory practice,Universiteit Leiden,4.762659210935073,3219,Beginner,Course,ONE_TO_THREE_MONTHS,public_safety national_security research policy_analysis medium communication social_studies world_history international_relations intelligence collection analysis political_science trend_analysis psychology,/learn/terrorism,True,course~A0IYf6jOEeSnlCIAC1EMbw
salesforce sale development representative,"Salesforce, SV Academy",4.433035714285714,560,Beginner,Professional Certificate,THREE_TO_SIX_MONTHS,overcoming_objections prospecting qualification customer_relationship_management lead_generation sale development time management_business writing salesforce writing sale prospecting cold calling growth_mindedness verbal_communication_skills cultural_diversity sale enablement empathy emotional_intelligence interviewing_skills professional_development sale,/professional-certificates/sales-development-representative,False,s12n~kp_FWsq_EeqCbA5r8FtmZQ
singer songwriter,Berklee,4.761694117647058,4250,Beginner,Specialization,THREE_TO_SIX_MONTHS,music_theory file_management music_performance music musical_composition peer_review instrumental_music selfawareness performing_arts automation editing software_installation creativity,/specializations/singer-songwriter,False,s12n~WCbyUH8rEeqYMgrG9uCSPQ
industrial biotechnology,University of Manchester,4.666761363636364,3520,Beginner,Course,ONE_TO_THREE_MONTHS,process_engineering molecular_biology chemical_engineering life_science biochemistry bioinformatics biology pharmaceutical environmental_engineering manufacturing_processes process development microbiology,/learn/industrial-biotech,True,course~Ffu_H13iEeWozxKwtAxdTQ
robotic process_automation rpa,UiPath,4.671399176954733,486,Beginner,Specialization,THREE_TO_SIX_MONTHS,robotic process_automation data_manipulation web scraping user_interface_ui business_process_automation automation email security ui_components test_automation excel macro scripting automation_data cleansing data_importexport software_development_tools data_management integrated development_environments data_integration application_deployment programming_principles,/specializations/roboticprocessautomation,False,s12n~poo8tArSEeyOcRI3eVVltQ
foundational finance strategic decision making,University of Michigan,4.736608557844691,1262,Beginner,Specialization,THREE_TO_SIX_MONTHS,market_data loan finance microsoft excel general finance corporate_finance mortgage_loan equity investment financial_analysis financial_market business_valuation investment_management financial_modeling capital_markets financial_forecasting business mathematics financial_planning cash flow complex_problem solving,/specializations/foundational-finance,False,s12n~rp2AfxUtEemIIApG5z08IA
excel power bi,Knowledge Accelerators,4.508953168044077,1452,Beginner,Course,ONE_TO_FOUR_WEEKS,power bi data presentation_data_visualization data_modeling dashboard data_importexport_data analysis_data_visualization software microsoft power platform microsoft excel business_intelligence_business analytics_data cleansing data_transformation_data sharing,/learn/from-excel-to-power-bi,True,course~G7SDef75Ee2ggA7J4inhdw
data_management clinical_research,Vanderbilt University,4.74015748031496,1778,Beginner,Course,ONE_TO_THREE_MONTHS,clinical_data_management data capture clinical_research data_management data_collection_data sharing data_strategy data_quality sampling_statistics data_integrity_data validation regulatory_compliance,/learn/clinical-data-management,True,course~-nkoihN6EeWCWhKuhISYpw
aws cloud practitioner essential,Amazon Web Services,4.776855215360664,1927,Beginner,Course,ONE_TO_THREE_MONTHS,amazon_web_services amazon cloudwatch public cloud aws_identity access_management iam cloud_computing cloud_platforms cloud_infrastructure amazon elastic compute cloud cloud_security amazon cloud_storage continuous_monitoring scalability,/learn/aws-cloud-practitioner-essentials,False,course~-N8vIjSrEeuqnBLYBE3j1Q
pricing strategy optimization,"University of Virginia, BCG",4.757442116868797,907,Beginner,Specialization,THREE_TO_SIX_MONTHS,price_negotiation market_dynamics product_lifecycle_management revenue_management competitive_analysis target_market global_marketing market share consumer_behaviour business_strategy product_strategy marketing_psychology marketing cost accounting customer_insights customer_analysis value_propositions strategic_marketing economics demand planning,/specializations/uva-darden-bcg-pricing-strategy,False,s12n~JCAQQoDREeaTMBL33MpMiw
ibm digital_marketing growth hacking,"IBM, SkillUp EdTech",4.470588235294118,17,Beginner,Professional Certificate,THREE_TO_SIX_MONTHS,social_media_management social_media content social_media_marketing social_media google ad digital_advertising web_analytics seo online_advertising digital_marketing social_media_strategy social_media_campaigns digital_media_strategy pay per click advertising search_engine_optimization content_performance_analysis instagram email marketing_content marketing paid_media generative ai,/professional-certificates/ibm-digital-marketing-and-growth-hacking,False,s12n~XZyNPfvcS0KnHrJbtV9f7A
positive psychology martin seligmans visionary science,University of Pennsylvania,4.853324746417647,6211,Beginner,Course,ONE_TO_FOUR_WEEKS,optimism personal_development resilience positive_behavior support psychology school_psychology working child education training research human_development creativity,/learn/positive-psychology-visionary-science,False,course~JWd4VXqhEeaDmw5QsxT7tQ
branding creative journey,IE Business School,4.622148058252428,1648,Beginner,Specialization,THREE_TO_SIX_MONTHS,brand_strategy customer_experience_strategy branding storytelling production planning logo design brand management_content marketing target_audience advertising_campaign content_creation advertising_marketing design creative_design marketing_communications brand_awareness proposal_development journalism creativity communication,/specializations/branding-the-creative-journey,False,s12n~ngnV57djEeiKOw5SJXYV1A
game_design art concept,California Institute of the Arts,4.685756312821771,4079,Beginner,Specialization,THREE_TO_SIX_MONTHS,animation game_design game_design animation prototyping conceptual_design video game development storytelling software_design_documents ideation visualization_computer_graphics storyboarding design virtual_environment art_history technical design_design_elements principle usability_testing creative_design design_strategies graphic visual_design,/specializations/game-design,False,s12n~oFD8C0eREeWilAqJEgBo2w
build dynamic user interface ui website,Google,4.788178657395026,3739,Beginner,Course,ONE_TO_FOUR_WEEKS,responsive_web_design user_experience_design design_reviews wireframing usability_testing_user research_user centered design_user_interface ui design prototyping mockups user flow information_architecture,/learn/responsive-web-design-adobe-xd,False,course~YLwdQgp-Eeu0VAqNda9Xjw
fundamental financial_analysis,London Business School,4.204081632653061,49,Beginner,Course,ONE_TO_FOUR_WEEKS,financial_statement_analysis financial_analysis financial_statement balance_sheet financial_reporting income_statement return investment accounting investment cash flow asset_management,/learn/fundamentals-of-financial-analysis,False,course~2zoj9oPUEe6CAw5QzIAFRQ
write feature length screenplay film television,Michigan State University,4.615658362989324,281,Beginner,Course,THREE_TO_SIX_MONTHS,storyboarding writing writing editing storytelling peer_review,/learn/write-a-feature-length-screenplay-for-film-or-television,True,course~2crM6R35EeqABw5uz2mAtw
fundamental flight mechanic,ISAE-SUPAERO,4.704059040590407,542,Beginner,Specialization,THREE_TO_SIX_MONTHS,mechanic thermal_management mechanical_engineering risk_control physical_science simulation applied_mathematics systems_of_measurement vibration engineering analysis_engineering_calculations physic safety_assurance mathematical_modeling energy utility algebra differential_equation scientific_visualization,/specializations/flight-mechanics-fundamentals,False,s12n~FxNjYF2rEeytrA6P1gaieQ
abnormal psychology,Wesleyan University,4.80655737704918,671,Beginner,Specialization,THREE_TO_SIX_MONTHS,motivational interviewing psychological_evaluations mental_health_diseases disorder mental_health_therapies behavioral_health mental behavioral_health psychiatry psychotherapy clinical_psychology behavior_management psychosocial assessment mental_health cultural_diversity psychology experimentation interpersonal_communications stress_management learning_theory health_disparities goal setting,/specializations/abnormal-psychology,False,s12n~sOm12fSLEeusDQ6MlgBl-w
database sql data_science python,IBM,4.651610564943597,22073,Beginner,Course,ONE_TO_THREE_MONTHS,sql database stored_procedure relational databases_database design query_language database management_data_analysis jupyter data_manipulation panda python_package python_programming transaction_processing,/learn/sql-data-science,False,course~GDQMSxDWEeitFhJL4G-A_g
microeconomics principle,University of Illinois Urbana-Champaign,4.764913899138992,3252,Beginner,Specialization,ONE_TO_THREE_MONTHS,supply demand economics market_dynamics business_economics policy analysis_business behavioral_economics business_operations economic_development price_negotiation socioeconomics consumer_behaviour economics_policy social_studies business_strategy market_research public_policies competitive_analysis resource_allocation revenue_management market_analysis,/specializations/microeconomics-principles,False,s12n~jOsQN9XgRF-KuQ1XGbUYPw
introduction software_engineering,IBM,4.686845827439887,3535,Beginner,Course,ONE_TO_THREE_MONTHS,software_development_life cycle software_architecture development_environment engineering_software software_design software_development_tools software_engineering program_development systems_development software_documentation software_design_patterns software_development_methodologies unified modeling_language integrated development_environments programming_principles application_development agile_methodology python_programming,/learn/introduction-to-software-engineering,False,course~FkAMrrwEEey8ogoy0lwspQ
dino dinosaur paleobiology,University of Alberta,4.912347354138399,3685,Beginner,Course,ONE_TO_THREE_MONTHS,biology physical_science life_science taxonomy environment scientific_methods_research timeline,/learn/dino101,True,course~y5G1vZheEeWF6gpQJiw6hQ
renewable energy,University of Colorado Boulder,4.768268434134218,1207,Beginner,Specialization,THREE_TO_SIX_MONTHS,feasibility_studies plant_operations management_project finance electric_power_systems electrical_power energy utility engineering facility operation basic electrical_system thermal_management systems_of_measurement financial_analysis electrical_system market_dynamics project_management_life cycle financial_forecasting construction_management emerging_technologies project_management environmental_issue,/specializations/renewable-energy,False,s12n~Am7GPB1SEeuKGg4E-brRrw
product ideation design management,"University of Maryland, College Park",4.493459302325581,688,Beginner,Specialization,THREE_TO_SIX_MONTHS,stakeholder_management product management_product_development new_product_development wireframing financial_statement product_design user_experience_design team_leadership prototyping competitive_analysis commercialization product_lifecycle_management financial_modeling value_propositions proposal writing innovation target_market market_opportunities ideation,/specializations/product-ideation-design-and-management,False,s12n~m5Vok4d3EeuFWg5UspyOyw
professionalism allied health,MedCerts,4.78818998716303,779,Beginner,Course,ONE_TO_THREE_MONTHS,healthcare_ethics conflict_management cultural_responsiveness patient_education counseling cultural_diversity cultural_sensitivity professionalism professional_development time_management emotional_intelligence teamwork interpersonal_communications conscientiousness communication trustworthiness compassion empathy ethical_standards conduct medical_privacy medical office procedure,/learn/professionalism-allied-health,False,course~rFJEh7nyEe2oxw5qVgw_VQ
investment portfolio_management,Rice University,4.509136468774095,2594,Beginner,Specialization,THREE_TO_SIX_MONTHS,portfolio_management financial_market investment securities_finance financial_systems securities_trading asset_management behavioral_economics capital_markets investment_management equity performance_measurement wealth_management finance financial_services performance analysis_risk_management return investment market_liquidity derivative,/specializations/investment-portolio-management,False,s12n~3chNALu-EeWxahI1i_zTqQ
responsible ai applying ai principle google cloud,Google Cloud,4.572948328267477,658,Beginner,Course,ONE_TO_THREE_MONTHS,data_ethics business_ethics accountability compliance_training ethical_standards conduct google cloud platform artificial_intelligence machine_learning_aiml governance decision making corporate_strategy,/learn/responsible-ai-applying-ai-principles-with-google-cloud,False,course~ksw42TxYEe6M6ArdAkKxFQ
applied data_science r,IBM,4.539123242349049,1209,Beginner,Specialization,THREE_TO_SIX_MONTHS,data storytelling interactive_data visualization_data_visualization software shiny r package_data_visualization data wrangling dashboard exploratory_data_analysis relational databases_data analysis ggplot database_design_data presentation sql plot_graphics leaflet software data_transformation_data manipulation web scraping r_programming,/specializations/applied-data-science-r,False,s12n~rHB3CJbpEeuYEBKGpndRbw
investment_management python machine_learning,EDHEC Business School,4.5988208871420575,1781,Beginner,Specialization,THREE_TO_SIX_MONTHS,investment management_portfolio_management text_mining asset management_network analysis_data_visualization software machine_learning_methods financial_data unstructured_data predictive_modeling web scraping machine_learning advanced_analytics financial_statement applied machine_learning financial_market financial_modeling return investment risk analysis_risk_management,/specializations/investment-management-python-machine-learning,False,s12n~gT9jkZzHEeiUDgozxArl9A
software_design architecture,University of Alberta,4.629187817258888,3940,Beginner,Specialization,THREE_TO_SIX_MONTHS,software_architecture model_view_controller unified modeling_language object oriented_design service oriented architecture_api design systems_architecture web_services software_design_patterns software_design simple object access protocol soap microservices restful_api software_design_documents software visualization code_review solution_architecture software system object oriented_programming oop java,/specializations/software-design-architecture,False,s12n~hESW_nCIEeeXkArE6jxxNg
satisfaction guaranteed develop customer loyalty online,Google,4.822041720509507,5417,Beginner,Course,ONE_TO_FOUR_WEEKS,customer_retention loyalty program ecommerce customer_relationship_management customer_service marketing digital_marketing web_analytics datadriven decisionmaking marketing_analytics performance_analysis customer_insights business_metrics,/learn/satisfaction-guaranteed,False,course~UK7yonsIEey1tgpUmO8AYQ
understanding clinical_research behind statistic,University of Cape Town,4.786050373650705,3613,Beginner,Course,ONE_TO_THREE_MONTHS,biostatistics statistical_method statistical_hypothesis_testing probability_statistics clinical_research statistical_analysis quantitative_research statistic descriptive_statistics statistical_inference data_collection probability,/learn/clinical-research,True,course~sQB40x47EeWS6wrbVw_uEw
statistical_analysis r public_health,Imperial College London,4.696254312469198,2029,Beginner,Specialization,THREE_TO_SIX_MONTHS,analytical_skills correlation analysis_regression_analysis sampling_statistics statistical_hypothesis_testing data_literacy_data analysis_r_programming descriptive_statistics statistical software biostatistics exploratory_data_analysis statistical_analysis statistical_programming statistic statistical_method public_health probability_statistics epidemiology statistical_modeling,/specializations/statistical-analysis-r-public-health,False,s12n~9GJm7lUPEeisFQ4yhHotIA
introduction learning experience_design lxd,University of Michigan,4.824390243902439,82,Beginner,Specialization,ONE_TO_THREE_MONTHS,multimedia learning_theory instructional_design web content_accessibility_guidelines educational material learning_management system course development design_thinking professional_development brainstorming education_software technology motivational skills_communication design content_creation studentcentred learning design_strategies prototyping creative_thinking diversity_equity inclusion_initiatives,/specializations/introduction-to-learning-experience-design,False,s12n~b_vpfZKmEe2Jkg5K4kWy3Q
practical guide trading,Interactive Brokers,4.381428571428571,770,Beginner,Specialization,THREE_TO_SIX_MONTHS,derivative equity future exchange risk_analysis financial_trading international_finance investment securities_trading financial_market risk_management financial_analysis financial_statement_analysis market analysis_analysis capital_markets tax balance_sheet financial regulation market_data technical_analysis,/specializations/financial-instruments-trading-investing,False,s12n~kb7LeVEXEeuiXA7mHjd41w
american contract law,Yale University,4.828373015873016,1008,Beginner,Course,ONE_TO_THREE_MONTHS,case_law legal_writing commercial_law legal_research contract review civil_law contract compliance,/learn/contracts-1,True,course~dgW3wBsGEei_MQpZDN51wg
managerial accounting fundamental,University of Virginia,4.778739184177997,809,Beginner,Course,ONE_TO_FOUR_WEEKS,management accounting cost accounting_accounting cost_benefit_analysis cost_management budget_management financial_accounting financial_data financial_analysis decision making data_visualization,/learn/uva-darden-managerial-accounting,False,course~IMUdhjZyEeei6hJT8psMrA
object oriented_programming java,"Duke University, University of California San Diego",4.608145279743621,14978,Beginner,Specialization,THREE_TO_SIX_MONTHS,unit_testing data_structure eventdriven_programming interactive_data_visualization java java programming development_testing user_interface_ui object oriented_programming oop debugging software_testing computer_programming cryptography software_engineering performance_tuning encryption algorithm data_analysis_software design problem solving,/specializations/object-oriented-programming,False,s12n~R_qPtn3yEee77xLkt23avA
cv health call center customer_service,CVS Health,4.696185286103543,367,Beginner,Professional Certificate,THREE_TO_SIX_MONTHS,active_listening call center experience deescalation technique greeting customer growth_mindedness customer_service empathy interviewing_skills cross selling retail sale data_entry customer relationship_building verbal_communication_skills upselling teamwork customer complaint resolution conflict_management product knowledge communication time_management,/professional-certificates/cvshealth-call-center-customer-service,False,s12n~Q02UEGd3Ee2CNhLmHVBplw
introduction frontend development,Meta,4.768075768075768,12987,Beginner,Course,ONE_TO_FOUR_WEEKS,html cs bootstrap_frontend_framework responsive_web_design frontend_web_development user_interface_ui javascript framework web_design development_web_applications web_development_tools reactjs javascript,/learn/introduction-to-front-end-development,False,course~jigZGJrqEey10AoWlnmjtw
school health child adolescent,University of Colorado System,4.782713478131509,3361,Beginner,Specialization,THREE_TO_SIX_MONTHS,autism spectrum disorder individualized education program iep special_education nutrition education community_health school_psychology chronic_diseases student support service nutrition diet school counseling public_health public_health disease_prevention mental behavioral_health_specialties care_management child_health patient_evaluation care coordination disability medical emergency behavioral_health,/specializations/school-health-for-children-and-adolescents,False,s12n~-KS2fmBZEeisuQ4PU38rnA
songwriting writing arranging producing music,Berklee,4.766682832201746,2062,Beginner,Specialization,THREE_TO_SIX_MONTHS,file_management music_theory musical_composition music peer_review instrumental_music storytelling music_performance performing_arts automation editing software_installation creativity writing,/specializations/songwriting,False,s12n~lqPWPDWZEeuiZgo2K4rorQ
understanding einstein special theory relativity,Stanford University,4.887189292543021,3138,Beginner,Course,ONE_TO_THREE_MONTHS,physic timeline verification validation scientific_methods_research mechanic mathematical_modeling systems_of_measurement,/learn/einstein-relativity,True,course~Is9jHhyKEeaHoAovRHhd_Q
real_estate property management,Coursera Instructor Network,4.714285714285714,119,Beginner,Course,ONE_TO_FOUR_WEEKS,property management property real_estate real_estate commercial real_estate asset_management property maintenance operational performance_management operational_efficiency innovation technology_strategies,/learn/real-estate-property-management,False,course~qNfMOifFEe-qLxJFbw2Hbw
