title,organization,rating,review_count,difficulty,course_type,duration,skills,url,is_free,course_id
google data analytics,Google,4.763390314226825,170291,Beginner,Professional Certificate,THREE_TO_SIX_MONTHS,data storytelling rmarkdown data_literacy_data visualization_data_presentation data_ethics_data cleansing interactive_data_visualization data_validation ggplot tableau_software sampling_statistics presentation spreadsheet_software_data analysis_data_visualization software stakeholder_communications linkedin interviewing_skills applicant_tracking_systems,/professional-certificates/google-data-analytics,False,s12n~kr43OcbTEeqeNBKhfgCLyw
google cybersecurity,Google,4.822850067537146,53304,Beginner,Professional Certificate,THREE_TO_SIX_MONTHS,threat_modeling network security_incident response vulnerability_management computer security_incident_management hardening intrusion_detection prevention cyber_threat_intelligence threat_management cyber_attacks cybersecurity_network protocol cloud_security vulnerability_assessments bash_scripting_language debugging linux interviewing_skills python_programming sql,/professional-certificates/google-cybersecurity,False,s12n~Dy6K-2UKEe2PIRJn6nL9pQ
google project_management,Google,4.842615375198921,130704,Beginner,Professional Certificate,THREE_TO_SIX_MONTHS,quality management_project_management life_cycle requirements_analysis project scoping project_closure project_management_project planning agile_project_management continuous_improvement_process project control backlog stakeholder_communications milestones_project_management quality assessment team_management agile_methodology_project documentation change_management interviewing_skills applicant_tracking_systems,/professional-certificates/google-project-management,False,s12n~fq9UWMbTEeqpthJ2RmWGow
google ai essential,Google,4.835467442706438,2749,Beginner,Specialization,ONE_TO_THREE_MONTHS,prompt_engineering_generative ai artificial_intelligence machine_learning_aiml large_language_modeling process_optimization productivity_software workforce_development digital_transformation innovation technical_writing emerging_technologies operational_efficiency business solution machine learning_software data_security critical_thinking analysis_data_analysis data_quality,/specializations/ai-essentials-google,False,s12n~3tzIujTqTk-YdcEFZ9r3sQ
google digital_marketing ecommerce,Google,4.801079871104221,40653,Beginner,Professional Certificate,THREE_TO_SIX_MONTHS,data storytelling search_engine_marketing medium planning social_media_marketing google ad email_marketing social_media_strategy search_engine_optimization order fulfillment social_media management_performance_measurement spreadsheet_software testing customer_retention ecommerce campaign_management loyalty program marketing interviewing_skills applicant_tracking_systems,/professional-certificates/google-digital-marketing-ecommerce,False,s12n~aYYrIEl-EeyCjQ5Y8Mzdsw
google support,Google,4.783728692276779,204034,Beginner,Professional Certificate,THREE_TO_SIX_MONTHS,computer networking package software_management network troubleshooting system administration cloud_infrastructure infrastructure information_systems_security tcpip network_security file_system microsoft window computer_security network_architecture application_security desktop_support computer_hardware technical_support interviewing_skills applicant_tracking_systems professional_development,/professional-certificates/google-it-support,False,s12n~7lHCSlFIEeeffRIHljDI_g
google ux design,Google,4.815436043653526,91539,Beginner,Professional Certificate,THREE_TO_SIX_MONTHS,responsive_web_design storyboarding wireframing user_experience_design uiux research_usability_testing information_architecture presentation user_research figma design_software_design review persona_user_experience web content_accessibility_guidelines mobile development_user_story cross platform development_data ethic usability interviewing_skills applicant_tracking_systems,/professional-certificates/google-ux-design,False,s12n~Z-5wCcbTEeqeNBKhfgCLyw
machine_learning,"DeepLearning.AI, Stanford University",4.894270395594846,34505,Beginner,Specialization,ONE_TO_THREE_MONTHS,unsupervised_learning supervised learning_machine_learning method classification regression_tree cart artificial_intelligence machine_learning_aiml applied_machine learning_machine_learning algorithms_machine learning jupyter data_ethics decision_tree learning_tensorflow scikit learn machine_learning_library artificial_intelligence numpy predictive_modeling deep learning_reinforcement learning random_forest algorithm feature_engineering,/specializations/machine-learning-introduction,False,s12n~nOOfCDWeEeuiZgo2K4rorQ
google prompting essential,Google,4.795606494746896,1047,Beginner,Specialization,ONE_TO_FOUR_WEEKS,data_visualization prompt_engineering_data presentation graphing generative ai_agents chatgpt ai_personalization generative ai timeline data_analysis taking_meeting minute artificial_intelligence complex_problem solving ideation business_correspondence report writing solution_design critical_thinking document management_machine_learning,/specializations/prompting-essentials-google,False,s12n~1a_Qa92eQkOSjt6VLZ6lsg
ai everyone,DeepLearning.AI,4.790127032730583,48334,Beginner,Course,ONE_TO_FOUR_WEEKS,data_ethics market_opportunities artificial_intelligence machine_learning_aiml artificial_intelligence team building machine_learning strategic_thinking data_science needs_assessment deep_learning business_ethics artificial_neural_networks engineering_management,/learn/ai-for-everyone,False,course~daG-a-O1EeijKBISCWxf6g
ibm data_science,IBM,4.615297066031598,144446,Beginner,Professional Certificate,THREE_TO_SIX_MONTHS,exploratory_data_analysis data wrangling dashboard data_visualization_software data_visualization sql unsupervised_learning plotly interactive_data_visualization data_transformation supervised_learning jupyter data_analysis_data cleansing data_manipulation_data literacy_data_mining matplotlib generative ai professional networking,/professional-certificates/ibm-data-science,False,s12n~dwzq23ZLEei12goo904QNg
ibm data analyst,IBM,4.634533442368939,92936,Beginner,Professional Certificate,THREE_TO_SIX_MONTHS,exploratory_data_analysis data storytelling_data wrangling dashboard data_visualization_software plotly data_visualization sql generative ai interactive_data_visualization data_transformation_data analysis data_cleansing jupyter big_data ibm cognos analytics excel_formulas python_programming professional networking microsoft excel,/professional-certificates/ibm-data-analyst,False,s12n~7qRy6fOWEeqIvgrCa-MVgQ
ibm generative ai engineering,IBM,4.644188591542938,88636,Beginner,Professional Certificate,THREE_TO_SIX_MONTHS,exploratory_data_analysis prompt_engineering_data wrangling large_language_modeling unsupervised_learning pytorch_machine_learning library generative ai chatgpt kera neural network library data_transformation flask_web_framework supervised_learning data_analysis_data cleansing data_manipulation unit_testing deep_learning jupyter regression analysis_data_importexport,/professional-certificates/ibm-generative-ai-engineering,False,s12n~FKdStbCPR16Ga6G64hBdFg
ibm ai developer,IBM,4.6413529610068505,71192,Beginner,Professional Certificate,THREE_TO_SIX_MONTHS,prompt_engineering software_development_life cycle large_language_modeling software_architecture chatgpt development_environment flask_web_framework generative ai cascading style_sheets_css unit_testing jupyter bootstrap_frontend_framework software_design software_development_tools software_engineering responsive_web_design python_programming engineering_software machine_learning data_science,/professional-certificates/applied-artifical-intelligence-ibm-watson-ai,False,s12n~WvWoOoMoEembCA7TjU2XTA
ai healthcare,Stanford University,4.720323325635106,2165,Beginner,Specialization,THREE_TO_SIX_MONTHS,feature_engineering healthcare_ethics pharmaceutical data_ethics clinical_research health_systems healthcare_industry_knowledge medical_record unstructured_data health_care patient_evaluation health_informatics data_mining clinical_data_management statistical_machine learning applied machine_learning electronic medical_record machine_learning artificial_intelligence health_technology,/specializations/ai-healthcare,False,s12n~68fXxAJgEeqJHxKP6A-i8w
data_science foundation,"University of London, IBM, IBM",4.62096941831378,113532,Beginner,Specialization,THREE_TO_SIX_MONTHS,dashboard pseudocode jupyter algorithms_data literacy_data_mining panda python_package data_visualization_software correlation_analysis web scraping numpy python_programming probability_statistics predictive_modeling computer_programming_tools data science_machine learning_algorithms unsupervised learning_machine_learning project_management,/specializations/data-science-foundations,False,s12n~peHrosLQQY6iMw-W3HCQzg
ibm full stack software developer,IBM,4.601036936389317,55934,Beginner,Professional Certificate,THREE_TO_SIX_MONTHS,prompt_engineering istio software_development_life cycle nodejs kubernetes cloud computing_architecture server side application_deployment react redux cloud_services django web_framework software_architecture objectrelational_mapping git version_control_system flask_web_framework fullstack_web_development cascading style_sheets_css cloud_computing jupyter engineering_software,/professional-certificates/ibm-full-stack-cloud-developer,False,s12n~PaymLStoEeuBuBIWkmAWww
ibm ai product manager,"IBM, SkillUp EdTech",4.698552081832592,27764,Beginner,Professional Certificate,THREE_TO_SIX_MONTHS,prompt_engineering_generative ai new_product development_product_management product_lifecycle management_product_development innovation product roadmaps chatgpt product planning commercialization artificial_intelligence product_strategy project_management_life cycle openai stakeholder_engagement stakeholder_management competitive analysis_product_testing business_development,/professional-certificates/ibm-ai-product-manager,False,s12n~dVxvpVBzSI2qpyGsH77oMQ
ibm devops software_engineering,IBM,4.625670283283317,60646,Beginner,Professional Certificate,THREE_TO_SIX_MONTHS,user_story cicd istio open_web application_security_project owasp software_development_life cycle continuous_integration linux command kubernetes cloud computing_architecture application_deployment test driven_development tdd gherkin scripting_language jenkins git version_control_system flask_web_framework devops jupyter grafana software engineering_application development,/professional-certificates/devops-and-software-engineering,False,s12n~kxXLY1kfEey5Tg6Gr7s2bQ
business foundation,University of Pennsylvania,4.705890810180688,25735,Beginner,Specialization,THREE_TO_SIX_MONTHS,operations_management return investment operational_efficiency financial_statement financial_statement_analysis finance human_capital go market_strategy process_analysis branding process management_people_management financial_reporting capital budgeting financial_accounting financial_modeling marketing_marketing planning_peer review corporate_finance,/specializations/wharton-business-foundations,False,s12n~AQ719YHLEeWWVhJkLv2LYQ
data_science fundamental python sql,IBM,4.564620012754044,72134,Beginner,Specialization,THREE_TO_SIX_MONTHS,dashboard sql descriptive_statistics jupyter statistical_analysis_data analysis probability_distribution panda python_package data_visualization_software statistic data_visualization statistical_hypothesis_testing database regression_analysis stored_procedure python_programming_data science data_structure computer_programming_tools data_analysis_software,/specializations/data-science-fundamentals-python-sql,False,s12n~kuGzQBrlEeuKTA7v2iL8uQ
ibm backend development,IBM,4.604353460494875,49386,Beginner,Professional Certificate,THREE_TO_SIX_MONTHS,istio open_web application_security_project owasp software_development_life cycle linux command kubernetes application_deployment nosql bash_scripting_language mongodb shell_script django web_framework software_architecture objectrelational_mapping development_environment git version_control_system flask_web_framework jupyter grafana microservices python_programming,/professional-certificates/ibm-backend-development,False,s12n~PfbRUmwSEe25uA4dnx38NQ
microsoft power bi data analyst,Microsoft,4.6402871065455,7593,Beginner,Professional Certificate,THREE_TO_SIX_MONTHS,power bi microsoft excel data analysis_data_visualization data_storage data_collection_data quality business_intelligence microsoft power platform advanced_analytics database_design statistical_reporting statistical_visualization analytical_skills data_integration business reporting data_storage_technologies sql microsoft sql server data_security,/professional-certificates/microsoft-power-bi-data-analyst,False,s12n~nF9rQ0oBQhy5Bfv-kRFZjg
introduction data_science,IBM,4.633733183180164,99454,Beginner,Specialization,THREE_TO_SIX_MONTHS,sql jupyter data literacy_data_mining peer_review_data modeling database stored_procedure relational databases_database design query_language data_science database_management big_data computer_programming_tools data_analysis_software data_cleansing software_development_tools cloud_computing python_programming,/specializations/introduction-data-science,False,s12n~_Fk2Gi3cEeiHghIydZ_0lA
ibm data analytics excel r,IBM,4.73211171096346,28896,Beginner,Professional Certificate,THREE_TO_SIX_MONTHS,data storytelling interactive_data visualization_data_visualization software_data_visualization shiny r package_data wrangling exploratory_data_analysis relational database big_data ggplot database_design_data analysis ibm cognos analytics data_presentation_data mining dashboard excel_formulas data_manipulation web scraping microsoft excel,/professional-certificates/ibm-data-analyst-r-excel,False,s12n~QQGg65luEeugtw5wj3v7iQ
applied data_science,IBM,4.587889842875083,58934,Beginner,Specialization,THREE_TO_SIX_MONTHS,exploratory_data_analysis data wrangling dashboard data_visualization_software plotly data_visualization interactive_data_visualization data_transformation_data analysis data_cleansing data_manipulation jupyter matplotlib data_importexport panda python_package predictive_modeling_data science_python programming_data_structures machine_learning,/specializations/applied-data-science,False,s12n~gw6NIUimEeiedgp7b7p1Ig
data_analysis visualization foundation,IBM,4.739442773241659,27924,Beginner,Specialization,THREE_TO_SIX_MONTHS,data storytelling data_visualization big_data data_visualization_software data analysis_dashboard ibm cognos analytics statistical_analysis_data mining apache hadoop tree map excel_formulas data wrangling apache hive data_collection_data mart data_science microsoft excel data_quality_data cleansing,/specializations/data-analysis-visualization-foundations,False,s12n~zjWaXRMhEeudwgrn4wF8EQ
applied software_engineering fundamental,IBM,4.609548614714124,48185,Beginner,Specialization,THREE_TO_SIX_MONTHS,software_development_life cycle linux command bash_scripting_language shell_script software_architecture development_environment git version_control_system github flask_web_framework unit_testing version_control file management_engineering software jupyter unix shell software_design linux application_deployment python programming_data_structures,/specializations/software-engineering-fundamentals,False,s12n~7ERwSQnXEe23EhLnQryuGw
ibm darden digital strategy,"University of Virginia Darden School Foundation, IBM",4.710094411285947,46075,Beginner,Specialization,THREE_TO_SIX_MONTHS,strategic_thinking digital transformation_business strategy cloud computing_architecture competitive_analysis cloud_services business_transformation cloud_security big_data cloud_platforms data_analysis statistical_analysis cloud_computing generative ai apache hadoop product_lifecycle_management strategic decisionmaking cloud_storage chatgpt data_science,/specializations/digital-strategy,False,s12n~lEbibxe6EemaCA6FO7suWg
ai foundation everyone,IBM,4.705323247180784,28554,Beginner,Specialization,THREE_TO_SIX_MONTHS,prompt engineering_chatgpt_generative ai openai workflow management_machine_learning application_deployment large_language_modeling ibm cloud artificial intelligence_program_development natural_language_processing deep_learning business_process_automation automation customer_service content_creation market_opportunities image analysis_data_science,/specializations/ai-foundations-for-everyone,False,s12n~5w9v9Jd_EemkYApdOSqZTg
ibm data_engineering,IBM,4.612633521236438,59073,Beginner,Professional Certificate,THREE_TO_SIX_MONTHS,nosql data warehousing sql apache hadoop extract transform_load_apache airflow web scraping linux command database_design ibm cognos analytics mysql apache spark database_administration data_store jupyter generative ai professional networking python programming_data_analysis data_science,/professional-certificates/ibm-data-engineer,False,s12n~4ZGJDStjEeupVg7HH9ybXQ
key technology business,IBM,4.686816258242298,101610,Beginner,Specialization,THREE_TO_SIX_MONTHS,cloud computing_architecture cloud_services cloud_security data literacy_data_mining cloud_platforms cloud_computing generative ai cloud_storage infrastructure service_iaas software service big_data emerging_technologies cloudnative_computing data analysis_data_science chatgpt natural_language_processing market_opportunities business,/specializations/key-technologies-for-business,False,s12n~mF13zqpxEeqDdgqb325wdw
introduction finance accounting,University of Pennsylvania,4.627610862342916,13846,Beginner,Specialization,THREE_TO_SIX_MONTHS,financial_statement return investment financial_statement_analysis financial_reporting capital budgeting financial_accounting financial_modeling working_capital balance_sheet accrual accounting_accounting cash flow income_statement finance financial_analysis tax_planning equity financial_planning corporate_finance business_valuation,/specializations/finance-accounting,False,s12n~XvFLWP2uEeqmKw5GnbMYDw
ai business,University of Pennsylvania,4.736286321757618,1411,Beginner,Specialization,THREE_TO_SIX_MONTHS,ai_personalization generative ai data_ethics tech data_governance big_data machine_learning personally identifiable_information data_security governance_business strategy human_resources organizational_strategy customer data_management credit_risk business_transformation artificial_intelligence risk_management datadriven decisionmaking analytics,/specializations/ai-for-business-wharton,False,s12n~Wh6nmdkOEeuYJQ5ZkEJmKQ
data_engineering foundation,IBM,4.616063734369779,56861,Beginner,Specialization,THREE_TO_SIX_MONTHS,sql web scraping database_design mysql data_transformation_data store ibm extract_transform load relational database jupyter data_architecture_data pipeline big_data_data warehousing_data governance database_management_system database stored_procedure python programming_data_structures,/specializations/data-engineering-foundations,False,s12n~aDZV7StjEeu8FgroulzDIw
ibm ai foundation business,"IBM, IBM",4.692099776776311,94972,Beginner,Specialization,ONE_TO_THREE_MONTHS,data literacy_data_mining generative ai big_data information_architecture strategic decisionmaking enterprise_architecture cloud_computing data analysis_data_science chatgpt digital_transformation data_strategy datadriven decisionmaking_business strategy business_process_automation data_architecture natural_language_processing market_opportunities leadership,/specializations/ibm-ai-foundations-for-business,False,s12n~zn_b0Y_lEeqE2Q5NANyNFw
supervised machine_learning regression classification,"DeepLearning.AI, Stanford University",4.898526272295296,29042,Beginner,Course,ONE_TO_FOUR_WEEKS,supervised_learning jupyter scikit learn machine_learning_library machine_learning numpy predictive_modeling feature_engineering artificial_intelligence classification regression_tree cart python_programming regression_analysis unsupervised_learning statistical_modeling,/learn/machine-learning,False,course~T7hf5jWeEeuGCBL8_hyTUQ
finance quantitative modeling analyst,University of Pennsylvania,4.532639097293081,16661,Beginner,Specialization,THREE_TO_SIX_MONTHS,return investment financial_reporting capital budgeting financial_statement financial_modeling mathematical_modeling statistical_modeling regression_analysis business_modeling income_statement financial analysis_risk_analysis cash flow business mathematics financial_planning corporate_finance predictive_analytics spreadsheet_software google sheet microsoft excel,/specializations/finance-quantitative-modeling-analysts,False,s12n~GM-5z8kaEembiRJiedmGqA
python everybody,University of Michigan,4.816333318933862,277788,Beginner,Specialization,THREE_TO_SIX_MONTHS,web scraping data_processing relational database data_visualization json database_design sql network_protocols web_services restful_api data_modeling programming_principles application_programming_interface api database_systems database_management extensible markup language xml data_structure data_collection computer_programming python_programming,/specializations/python,False,s12n~F-h1g0w7EeWeOApO_l5R1w
foundation project_management,Google,4.862476326005295,95569,Beginner,Course,ONE_TO_FOUR_WEEKS,project_management_life cycle change_management organizational_structure project_management organizational_change program management_project closure agile_methodology_project planning waterfall_methodology strategic_thinking,/learn/project-management-foundations,False,course~fxgoIcbTEeqZOA5eKDHL-w
foundation data_data everywhere,Google,4.80288644460586,115644,Beginner,Course,ONE_TO_FOUR_WEEKS,data ethics_data_analysis datadriven decisionmaking google sheet spreadsheet_software analytical_skills data sharing data_cleansing data_processing data_visualization_software data_visualization sql data_management,/learn/foundations-data,False,course~kvb6uMbTEeqZOA5eKDHL-w
ibm data_management,"IBM, SkillUp EdTech",4.719397441188609,16961,Beginner,Professional Certificate,THREE_TO_SIX_MONTHS,dashboard_data storytelling_data warehousing sql data_governance data_visualization_data security data_migration database_design_data literacy mysql descriptive_statistics extract transform_load_data store data_management relational database database data_architecture excel_formulas business_intelligence,/professional-certificates/ibm-data-manager,False,s12n~QQ5c1Vt_TuSo7yidEbTkPw
meta fullstack developer,Meta,4.688556919170547,23630,Beginner,Specialization,THREE_TO_SIX_MONTHS,jest javascript testing_framework django web_framework version_control restful_api responsive_web_design unix command html cs git version_control_system github relational database object oriented_programming oop database_management_system bootstrap_frontend_framework reactjs mobile_development sql database_design api_design linux command python_programming,/specializations/meta-full-stack-developer,False,s12n~JlxJAk26SC-XRTs8e7k0eQ
meta frontend developer,Meta,4.691510312707918,22545,Beginner,Professional Certificate,THREE_TO_SIX_MONTHS,jest javascript testing_framework version_control uiux research_usability_testing responsive_web_design data_structure unix command html cs git version_control_system persona_user_experience github interaction_design user_experience_design bootstrap_frontend_framework reactjs mobile_development frontend_web_development algorithm javascript cascading style_sheets_css,/professional-certificates/meta-front-end-developer,False,s12n~KPSzVL9AEeyfhAreTccY9Q
generative ai fundamental,IBM,4.713973742363187,7693,Beginner,Specialization,THREE_TO_SIX_MONTHS,prompt_engineering_generative ai chatgpt openai data_ethics large_language_modeling leadership management_business leadership strategic_leadership business_ethics legal_risk ibm cloud tensorflow artificial intelligence_program_development artificial_neural_networks business_development deep_learning content_creation business_transformation,/specializations/generative-ai-for-everyone,False,s12n~dSxE02kGQsOqXAMX5fKCVQ
ibm fullstack javascript developer,IBM,4.578889326506496,7617,Beginner,Professional Certificate,THREE_TO_SIX_MONTHS,istio software_development_life cycle nodejs kubernetes server side mongodb application_deployment cicd cloudnative_computing react redux nosql software_architecture development_environment restful_api git version_control_system cascading style_sheets_css ajax javascript azure devops engineering_software,/professional-certificates/ibm-full-stack-javascript-developer,False,s12n~XZeuiy7pR5qeZeOfWIzqXg
introduction ai,Google,4.870112657388999,1509,Beginner,Course,ONE_TO_FOUR_WEEKS,generative ai artificial_intelligence machine_learning_aiml machine learning_software machine_learning innovation data_quality critical_thinking,/learn/google-introduction-to-ai,False,course~unfSix6kEfC5wQ7Ux-t3bw
ibm business analyst,"IBM, SkillUp EdTech",4.731680916150286,12749,Beginner,Professional Certificate,THREE_TO_SIX_MONTHS,data storytelling requirements_elicitation risk_mitigation_business analysis_business_process modeling_risk analysis_project scoping process_optimization_data visualization requirements_management prompt_engineering risk_management_business requirement stakeholder_management work_breakdown_structure stakeholder_engagement excel_formulas microsoft excel business_analytics analysis,/professional-certificates/ibm-business-analyst-professional-certificate,False,s12n~HIn2o-RMQnC791z_YC-7IA
