title,organization,rating,review_count,difficulty,course_type,duration,skills,url,is_free,course_id
kinematics describing motion spacecraft,University of Colorado Boulder,4.862686567164179,335,Advanced,Course,ONE_TO_FOUR_WEEKS,mechanic linear_algebra numerical analysis_engineering_calculations engineering_analysis differential_equation trigonometry physics_mathematical_modeling applied_mathematics advanced_mathematics algorithm systems_of_measurement,/learn/spacecraft-dynamics-kinematics,False,course~uuVy6-J8EeaKBwrG-FP2zg
infrastructure transportation system,L&T EduTech,4.375,8,Advanced,Specialization,THREE_TO_SIX_MONTHS,construction_engineering civil_engineering_construction building service engineering civil architectural_engineering hvac public work transportation_operations architecture construction_construction management structural_engineering_engineering design_process structural_analysis building_design facility_management emerging_technologies engineering_calculations energy utility environmental_engineering architectural_design,/specializations/infrastructure-for-transportation-systems,False,s12n~smahjSR1R5OIjbArjOMnbw
mastering geospatial analysis qgis,L&T EduTech,4.047619047619048,21,Advanced,Course,ONE_TO_THREE_MONTHS,spatial_analysis gi software spatial_data_analysis geospatial_mapping geographic_information_systems building information_modeling data_manipulation global_positioning_system network_analysis image analysis_data_importexport unsupervised_learning software_installation supervised_learning ui_components,/learn/mastering-geospatial-analysis-with-qgis,False,course~-CoDwy4CEe-GuAr_9hcaqw
steel multi storey building system_design,L&T EduTech,4.862068965517241,29,Advanced,Specialization,THREE_TO_SIX_MONTHS,construction_inspection structural_analysis structural_engineering_building design_construction building_code architectural drawing industrial design commercial_construction architectural_engineering engineering_drawings civil_engineering computeraided_design failure_analysis technical drawing engineering analysis_engineering_calculations environmental_engineering engineering_design_process engineering_software,/specializations/steel-multi-storey-building-system-design,False,s12n~qzcEMwAFSG2qCrnebaIaLg
visual perception selfdriving car,University of Toronto,4.672977624784854,581,Advanced,Course,ONE_TO_THREE_MONTHS,computer_vision_image analysis deep_learning computer_graphic artificial_neural_networks visualization_computer_graphics artificial_intelligence machine_learning_aiml python_programming linear_algebra,/learn/visual-perception-self-driving-cars,False,course~Pr5NLlPyEei-RQ6pitSIHg
geotechnical foundation design,L&T EduTech,4.8,5,Advanced,Specialization,THREE_TO_SIX_MONTHS,building_codes_construction laboratory_testing structural_engineering laboratory_experience construction_engineering geostatistics civil_engineering environmental_monitoring experimentation research report engineering_practices engineering analysis_engineering_calculations structural_analysis failure_analysis finite_element_methods engineering scientific technical_instruments engineering_design_process simulation simulation_software,/specializations/geotechnical-foundation-design,False,s12n~1Ijl2E--QSKSHR8rnMVJJg
precast structural system,L&T EduTech,4.777777777777778,9,Advanced,Specialization,THREE_TO_SIX_MONTHS,shop drawing structural_engineering_building code architectural drawing construction_inspection building_design construction_engineering structural analysis_construction manufacturing_processes construction_management civil engineering_engineering tolerance engineering_practices architectural_engineering engineering_software engineering_design_process engineering analysis_product_testing engineering_calculations,/specializations/precast-structural-system,False,s12n~5gipjD2bTreS6KmHgXsDjA
devops dataops mlops,Duke University,4.1502890173410405,173,Advanced,Course,ONE_TO_THREE_MONTHS,mlops_machine learning_operations data_ethics artificial_intelligence machine_learning_aiml containerization rust programming_language devops applied machine_learning cloud solution cicd machine_learning python_programming serverless_computing application_frameworks docker_software generative ai_agents github commandline_interface big_data,/learn/devops-dataops-mlops-duke,False,course~6rD1kx_pEe2Psg5YTxx2NQ
strategy heavy lifting,L&T EduTech,4.444444444444445,9,Advanced,Specialization,THREE_TO_SIX_MONTHS,structural_engineering construction_engineering engineering_management equipment_design construction_management engineering_practices engineering plan specification hydraulics architecture construction mechanic construction_engineering torque_physics engineering_calculations civil_engineering structural_analysis safety_assurance mechanical_engineering_engineering analysis_estimation,/specializations/strategies-for-heavy-lifting,False,s12n~87ESinHoQRWhM0F8mKwKBA
spacecraft formation relative orbit,University of Colorado Boulder,5.0,7,Advanced,Specialization,ONE_TO_THREE_MONTHS,control_system vibration systems_engineering mechanic numerical_analysis differential_equation mathematical_modeling simulation simulation software_engineering analysis simulation advanced_mathematics linear_algebra engineering_design_process engineering_calculations applied_mathematics physic calculus,/specializations/spacecraft-formation-relative-orbits,False,s12n~ewToKdYpSF2VaCE8y26bUQ
transformer model bert model,Google Cloud,4.140350877192983,114,Advanced,Course,ONE_TO_FOUR_WEEKS,large_language_modeling natural_language_processing generative ai artificial_neural_networks,/learn/transformer-models-and-bert-model,True,course~Fhgepv_gEe2Saw6X32yGyQ
causal inference,Columbia University,3.383838383838384,99,Advanced,Course,ONE_TO_THREE_MONTHS,statistical_inference regression_analysis statistical_method estimation statistical_modeling machine_learning experimentation data_collection probability_statistics research_design program_evaluation decision making,/learn/causal-inference,True,course~tJApe-HgEeeSKxKWkG_JMg
design highperformance optical system,University of Colorado Boulder,4.63265306122449,49,Advanced,Course,ONE_TO_THREE_MONTHS,display device electrical_engineering system design_computer display human_factors engineering_calculations technical_design image analysis_simulation simulation_software mathematical_modeling applied_mathematics engineering_design_process,/learn/design-high-performance-optical-systems,False,course~iL7Ll24lEeeWCg71xNIlJg
ai capstone project deep_learning,IBM,4.513931888544891,646,Advanced,Course,ONE_TO_FOUR_WEEKS,pytorch_machine_learning library kera neural network library image analysis_data_manipulation deep_learning verification validation data_processing predictive_modeling applied_machine learning_computer vision scientific_visualization artificial_neural_networks,/learn/ai-deep-learning-capstone,False,course~KbAzfZkfEemG9Q7ob3lqoA
optical efficiency resolution,University of Colorado Boulder,4.161290322580645,62,Advanced,Course,ONE_TO_THREE_MONTHS,electrical_engineering simulation simulation_software system_design implementation image_analysis medical_imaging engineering_analysis applied_mathematics physic,/learn/optical-efficiency-and-resolution,False,course~b5T-IG4lEeez8xK4FEa7iA
production machine_learning system,Google Cloud,4.5938735177865615,1012,Advanced,Course,ONE_TO_THREE_MONTHS,mlops_machine learning_operations systems_design tensorflow hybrid cloud_computing google cloud platform system architecture_performance tuning applied_machine learning_machine_learning distributed_computing scalability data_pipelines,/learn/gcp-production-ml-systems,False,course~BwuL5JwaEeigWgp_hi6FmA
semiconductor physic,University of Colorado Boulder,4.3883161512027495,291,Advanced,Course,ONE_TO_FOUR_WEEKS,semiconductor electrical_engineering electronic_components electronics applied_mathematics,/learn/semiconductor-physics,False,course~QHSFA24mEeeWCg71xNIlJg
create design digital product using canva,Coursera Project Network,4.43218954248366,1224,Advanced,Guided Project,LESS_THAN_TWO_HOURS,canva software_design digital design_design_elements principle product_design color_theory graphic_design intellectual_property product promotion ecommerce digital_assets marketing_marketing material,/projects/create-design-digital-products-canva,True,course~cvZHh-n6EeqTzBKilmbQoQ
advanced microsoft power bi,Edureka,4.380281690140845,71,Advanced,Course,ONE_TO_FOUR_WEEKS,dashboard power bi data_transformation_data modeling interactive_data_visualization microsoft power platform data_visualization_software business_intelligence predictive_analytics microsoft excel data_analysis data_integration_data cleansing key_performance_indicators kpis,/learn/advanced-microsoft-power-bi,False,course~G-GCrOG4Ee6kgA4xMDRraQ
bridge infrastructure design,L&T EduTech,4.923076923076923,13,Advanced,Specialization,ONE_TO_THREE_MONTHS,engineering_calculations structural_engineering structural_analysis construction_engineering civil_engineering_construction engineering_analysis building_code engineering_practices construction_inspection conceptual_design engineering_design_process engineering environmental_engineering maintenance_repair facility_services facility repair maintenance finite_element_methods continuous_monitoring hydraulics failure_analysis,/specializations/bridge-infrastructure-design,False,s12n~NAaqmb9DQ6C6O9n26fRrqQ
advanced java,LearnQuest,4.4375,48,Advanced,Course,ONE_TO_FOUR_WEEKS,apache maven spring_framework microservices spring_boot java java programming backend web development_software_architecture server side load balancing cloud development restful_api systems_architecture web_applications scalability,/learn/advanced-java,False,course~Ms4VneXIEe2AzgrDscffMQ
leadership box,Queen Mary University of London,4.676300578034682,173,Advanced,Specialization,THREE_TO_SIX_MONTHS,stakeholder management_stakeholder_engagement delegation skill team_leadership team management_change management_team_performance management professional networking leadership_development organizational_change leadership matrix management_people_management team building time_management executive presence organizational_leadership_leadership management virtual_teams influencing,/specializations/leadership-out-of-the-box,False,s12n~KLYQ_8-REeuEhhLKgO18hw
mlops platform amazon sagemaker azure ml,Duke University,3.625,48,Advanced,Course,ONE_TO_THREE_MONTHS,aws sagemaker mlops_machine learning_operations microsoft azure exploratory_data_analysis data_pipelines amazon_web_services feature_engineering cloud solution cloud engineering_cloud platform machine learning_software artificial_intelligence machine_learning_aiml data_analysis predictive_modeling machine_learning_methods serverless_computing amazon machine learning_machine_learning algorithm python_programming,/learn/mlops-aws-azure-duke,False,course~YQxyoB_pEe2Psg5YTxx2NQ
advanced kubernetes,LearnQuest,3.759259259259259,27,Advanced,Specialization,ONE_TO_THREE_MONTHS,kubernetes rolebased_access control rbac cicd application_deployment network troubleshooting devops performance_tuning scalability continuous_integration containerization continuous_deployment package software_management yaml network_security network_performance_management cloud management_system monitoring_network monitoring continuous_monitoring git version_control_system,/specializations/advanced-kubernetes,False,s12n~DLtRkfVeSGyUoWM4pFWfoA
exam prep sapc aws solution architect professional,Whizlabs,5.0,1,Advanced,Specialization,THREE_TO_SIX_MONTHS,aws_identity access_management iam amazon cloudwatch aws sagemaker amazon dynamodb amazon redshift serverless_computing amazon_web_services identity access_management amazon aws cloudformation cloud_management aws kinesis infrastructure code iac cloud security_network_security threat_detection amazon elastic compute cloud network_architecture infrastructure_security containerization,/specializations/exam-prep-sap-c02-aws-certified-solutions-architect-professional,False,s12n~27Z-0AEqQqGLMkEhsppobA
strategic business_analytics,ESSEC Business School,4.391318074191004,1267,Advanced,Specialization,THREE_TO_SIX_MONTHS,marketing_analytics business_analytics forecasting peer_review data_presentation predictive_analytics customer_analysis information_technology digital transformation_business marketing advanced_analytics marketing_strategies statistical_analysis communication market_research complex_problem solving analytics_data synthesis r programming_data_analysis,/specializations/strategic-analytics,False,s12n~idRxikeyEeW57gqKtBwG2w
innovation entrepreneurship,Tecnolgico de Monterrey,4.401408450704225,71,Advanced,Specialization,THREE_TO_SIX_MONTHS,design_thinking innovation_business modeling creative problemsolving entrepreneurship ideation lean_methodologies process development creative_thinking new_product_development business architecture creativity storytelling corporate_strategy team management_business_strategy organizational_strategy strategic_planning customer_experience_improvement customer_engagement,/specializations/innovation-entrepreneurship,False,s12n~PU9Pcj0UEeu_Yg6ZI0UHjQ
leading family business,Tecnolgico de Monterrey,4.36,50,Advanced,Specialization,THREE_TO_SIX_MONTHS,succession planning innovation_business modeling value_propositions governance entrepreneurship lean_methodologies leadership management_leadership business_leadership corporate_strategy new_product_development ideation strategic_leadership business_strategy sales_presentations leadership_development new business_development talent management_business planning,/specializations/leading-family-business,False,s12n~Fy4nD4KkEeuMpQp-EX0CJQ
construction practice deep excavation tunnel,L&T EduTech,4.75,4,Advanced,Specialization,THREE_TO_SIX_MONTHS,construction engineering_building_codes structural_engineering structural_analysis_engineering analysis_construction engineering_calculations simulation simulation_software finite_element_methods civil engineering_construction_management engineering_practices environmental_monitoring safety_assurance architecture construction civil architectural_engineering failure analysis_building design environmental_engineering engineering_design_process,/specializations/construction-practices-in-deep-excavations-and-tunnels,False,s12n~Q860YGPDRX6wSs9lc02eTg
ccna advanced wan security network service,Packt,4.5,10,Advanced,Course,THREE_TO_SIX_MONTHS,open shortest path first ospf virtual local_area network vlan wide_area_network network security_threat_detection threat management_network administration multiprotocol label switching network routing virtual private_networks_vpn network troubleshooting dynamic host_configuration_protocol dhcp network switch network_protocols,/learn/packt-network-security-and-optimization-e49fk,False,course~TibneGeiEe-zXBID9Vp6zQ
light emitting diode semiconductor laser,University of Colorado Boulder,3.869565217391304,46,Advanced,Course,ONE_TO_THREE_MONTHS,semiconductor electrical engineering_electronics electronic_components engineering_analysis mathematical_modeling physic,/learn/leds-semiconductor-lasers,False,course~UnzxJW4jEeez8xK4FEa7iA
diode junction metal semiconductor contact,University of Colorado Boulder,4.517123287671233,292,Advanced,Course,ONE_TO_FOUR_WEEKS,semiconductor electrical_engineering electronic_systems electronic_components electronics mathematical_modeling,/learn/diode-pn-junction-metal-semiconductor-contact,False,course~Y2Lu2G4mEeeWCg71xNIlJg
transistor field effect transistor bipolar junction transistor,University of Colorado Boulder,4.2,85,Advanced,Course,ONE_TO_FOUR_WEEKS,semiconductor electronic_components electrical engineering_electronics electronics_engineering,/learn/transistor-field-effect-transistor-bipolar-junction-transistor,False,course~iIfnzW4mEeenOwpmZ1LH1g
tree graph basic,University of Colorado Boulder,4.635294117647059,170,Advanced,Course,ONE_TO_FOUR_WEEKS,graph_theory data_structure algorithm tree map analysis computational_thinking network_analysis python_programming,/learn/trees-graphs-basics,False,course~-OqlvFXeEeuhCA5K4_4e8w
probabilistic graphical model inference,Stanford University,4.596311475409836,488,Advanced,Course,ONE_TO_THREE_MONTHS,bayesian network bayesian_statistics statistical_inference markov model graph_theory sampling_statistics applied machine_learning statistical_method probability_statistics algorithm probability_distribution machine learning_algorithms computational_thinking,/learn/probabilistic-graphical-models-2-inference,False,course~ZearHHitEeaYNAqJlKFl8Q
excelvba creative problem solving part project,University of Colorado Boulder,4.852173913043479,460,Advanced,Course,ONE_TO_THREE_MONTHS,peer_review microsoft excel visual basic programming_language project_design simulation user_interface_ui automation debugging data_management,/learn/excel-vba-for-creative-problem-solving-part-3-projects,False,course~cDXfJhBlEei39QrsjEDTBA
recommendation system google cloud,Google Cloud,4.468619246861925,478,Advanced,Course,ONE_TO_THREE_MONTHS,reinforcement_learning google cloud platform artificial_intelligence machine_learning_aiml machine learning_machine_learning algorithm deep_learning applied machine_learning unsupervised_learning artificial_neural_networks feature_engineering predictive_modeling_data processing,/learn/recommendation-models-gcp,False,course~LsMF0rxtEei1aQ5Zl9xCuA
concrete multi storey building system_design,L&T EduTech,4.764814814814815,54,Advanced,Specialization,ONE_TO_THREE_MONTHS,architectural drawing structural_engineering structural_analysis building_design engineering_drawings engineering documentation building_codes_construction estimating civil engineering_engineering practice construction_construction_engineering architectural_engineering vibration engineering_calculations design specification engineering_software engineering_design_process engineering_analysis estimation,/specializations/concrete-multi-storey-building-system-design,False,s12n~dJkrnxaoSB-1TTCBJJO7Rw
mechanization construction,L&T EduTech,4.5,2,Advanced,Specialization,THREE_TO_SIX_MONTHS,safety_training construction maintenance_repair facility_services safety_assurance hydraulics construction_engineering equipment_design facility_management maintenance general construction construction labor plant_operations management construction_management grading landscape construction_inspection civil_engineering machine control structural_engineering commercial_construction vibration mechanical_engineering risk_control,/specializations/mechanization-in-construction,False,s12n~mMVai3AYQJ6HgSjJlbPJ7A
product_management capstone project,IBM,4.646153846153847,65,Advanced,Course,ONE_TO_THREE_MONTHS,usability_testing product_lifecycle management_product_management product_testing product roadmaps agile product_development_product development new_product_development portfolio_management market_analysis product_requirements business_strategy demand generation product_strategy market_intelligence marketing_planning,/learn/product-management-capstone,False,course~DaK_AW1DEe6ZoQ5WeLvw3w
computer_vision fundamental google cloud,Google Cloud,4.5486238532110095,545,Advanced,Course,ONE_TO_THREE_MONTHS,tensorflow computer_vision_image analysis applied machine_learning artificial_neural_networks deep_learning supervised_learning google cloud platform machine_learning_methods feature_engineering artificial_intelligence machine_learning_aiml small data data_processing cloud api,/learn/image-understanding-tensorflow-gcp,False,course~Y23EubLbEeiKUAqNzm0xRA
advanced data_engineering snowflake,Snowflake,4.833333333333333,6,Advanced,Course,ONE_TO_FOUR_WEEKS,data_engineering database_management database data_pipelines devops cicd commandline_interface version_control_system monitoring continuous_monitoring_data analysis,/learn/advanced-data-engineering-with-snowflake,False,course~YZzx6QjfEfC6EhJcncb--Q
machine_learning capstone,IBM,4.6438356164383565,146,Advanced,Course,ONE_TO_THREE_MONTHS,exploratory_data_analysis unsupervised_learning supervised_learning data_analysis applied machine_learning statistical analysis_data_presentation technical_communication machine_learning scikit learn machine_learning_library python_programming tensorflow regression_analysis kera neural network library artificial_neural_networks,/learn/machine-learning-capstone,False,course~apQ3VMcdEeyduw6ktL3Xvw
dynamic programming greedy algorithm,University of Colorado Boulder,4.635135135135135,222,Advanced,Course,ONE_TO_FOUR_WEEKS,algorithm data_structure theoretical_computer_science computational_thinking computer_science programming_principles_python programming advanced_mathematics design_strategies mathematical_theory_analysis analysis,/learn/dynamic-programming-greedy-algorithms,False,course~Zqm9TFXfEeuDVRIP_gaKjw
practice exam aipmm certified product manager cpm,SkillUp EdTech,4.923076923076923,39,Advanced,Course,ONE_TO_FOUR_WEEKS,product management_product_lifecycle management go market_strategy agile_methodology innovation market_analysis,/learn/practice-exam-for-aipmm-certified-product-manager-cpm,False,course~TjnGPr-8Ee6Newq-PzDcDw
probabilistic graphical model learning,Stanford University,4.561056105610561,303,Advanced,Course,ONE_TO_THREE_MONTHS,bayesian network applied_machine learning_machine_learning algorithm markov model machine_learning statistical_modeling network_analysis unstructured_data statistical_method probability_statistics algorithm,/learn/probabilistic-graphical-models-3-learning,False,course~g4sFEnitEeaCZBIelfdoiQ
use canva design digital course collateral,Coursera Project Network,4.56951871657754,1496,Advanced,Guided Project,LESS_THAN_TWO_HOURS,canva software color_theory developing training material digital design_design_elements principle graphic_design creative design_marketing social_media,/projects/canva-design-digital-course-collateral,True,course~mrIMl7RzEeqwphJAoMNkJw
reliable google cloud_infrastructure design process,Google Cloud,4.73907028223575,7228,Advanced,Course,ONE_TO_THREE_MONTHS,application_deployment cloud_infrastructure cicd cloud_security service_level_agreement microservices service_level google cloud platform network_architecture api_design site reliability_engineering cloud computing_architecture kubernetes restful_api cloud_storage cloud_computing cloud_applications key_performance_indicators kpis devops disaster_recovery,/learn/cloud-infrastructure-design-process,False,course~Hdkvqa-VEeemsBI74hnnzA
natural attenuation groundwater contaminant new paradigm technology application,Rice University,4.780632411067193,506,Advanced,Course,ONE_TO_THREE_MONTHS,environmental_monitoring environmental_engineering water_resources geostatistics environmental_science mathematical_modeling laboratory_research microbiology biology chemical_engineering chemistry hydraulics,/learn/natural-attenuation-of-groundwater-contaminants,False,course~shPviriqEeWVcRIZgPr_Xw
linux kernel programming introduction yocto project,University of Colorado Boulder,4.611111111111111,18,Advanced,Course,ONE_TO_FOUR_WEEKS,system_programming linux embedded_systems debugging operating_system peripheral_device build tool file_system shell_script c_programming_language development_environment commandline_interface data_structure,/learn/linux-kernel-programming-yocto-project,False,course~V7p62q93Eeusrg6wKBIcAw
natural_language_processing google cloud,Google Cloud,4.414953271028037,535,Advanced,Course,ONE_TO_THREE_MONTHS,natural_language_processing large_language_modeling tensorflow google cloud platform kera neural network library deep_learning artificial_intelligence machine_learning_aiml artificial_neural_networks cloud api cloud solution feature_engineering application_programming_interface api,/learn/sequence-models-tensorflow-gcp,False,course~7sNP37xrEeiL4Q6DgrZ6DA
advanced resource enterprise management primavera,Packt,4.761904761904762,21,Advanced,Course,ONE_TO_THREE_MONTHS,earned_value management_resource planning scheduling resource_management resource_allocation capacity planning resource utilization project_schedules project_management_project coordination project_management_software project control cost_management enterprise resource_planning performance metric work_breakdown_structure budget_management expense_management change_control data_importexport,/learn/packt-advanced-resource-and-enterprise-management-in-primervera-p6-azyqk,False,course~JJ-30GFmEe-e0g4kKcdYJQ
full stack application_development capstone project,IBM,4.590163934426229,183,Advanced,Course,ONE_TO_THREE_MONTHS,fullstack_web_development cicd kubernetes application_deployment application_development frontend_web_development restful_api software_architecture microservices web_applications containerization serverless_computing cloud_applications html cs backend web_development docker_software nodejs user account django web_framework javascript,/learn/ibm-cloud-native-full-stack-development-capstone,False,course~Pe7fmStoEeuLaArN6b47Fw
project_management capstone,IBM,4.901960784313726,102,Advanced,Course,ONE_TO_THREE_MONTHS,peer_review project management_project_management life_cycle agile project_management_project portfolio_management project_closure project control work_breakdown_structure backlog user_story scrum_software_development project_planning_project documentation_project performance risk management_stakeholder_management quality management_communication planning change management_leadership,/learn/ibm-project-management-capstone,False,course~Rm5xW9JGEe2_vw4ejszVZQ
